{
  "schema": "pi-ticket-planning:controller-trust-registry:v1",
  "digestAlgorithm": "utf16-code-unit-canonical-json-v1+sha256-hex",
  "activeIdentityDigest": "305d3c59024c7925d71d91126e61968246824353477b7b0e0e970abddb2d6f57",
  "entries": [
    {
      "identity": {
        "version": 1,
        "sourceRevision": "1d532133657e763f8e50429774eabf01c45f98e9",
        "sourceManifestDigest": "1791bc4ba77b4f6e790138f8ae4fba51706f496f3771df33502cd02369871119",
        "buildDigest": "d459a0be9843072882d5cd23c16a1363eb4f86306f75eb0e988a4fa05bbd9e97",
        "digest": "310bc0727db0dd94eb9369320416c4b4230ffc14be161c765c5d388d917e4d04"
      },
      "ownedSchemas": [
        {
          "schema": "herdr-codex-controller:release-completion:v2",
          "sha256": "sha256:d3c67f7d6abea0b86eed716cd27cd75759800a7b83e51931a58a92c08c791e7d"
        },
        {
          "schema": "herdr-codex-controller:release-plan:v2",
          "sha256": "sha256:362c9ae154c502ce80df16f17527c7136f4de2804da55c1c7c1314882160f363"
        },
        {
          "schema": "herdr-codex-controller:config:v2",
          "sha256": "sha256:d737bd7b59c392c815b7baf4805f3de891752815e868fbff81ffb066e8cb9778"
        }
      ],
      "qualificationStatus": "qualified",
      "activatedAt": "2026-08-31T04:56:08.000Z",
      "revocation": null,
      "historyDigest": null,
      "qualificationDigest": "sha256:f56b4a9246c3102de739576413cdbf371289ab368ef2703323935e51a313274b",
      "active": false
    },
    {
      "identity": {
        "version": 1,
        "sourceRevision": "4d6295af2f1533a8fee5ffe1d420241bc1f5bcba",
        "sourceManifestDigest": "5a6a2a719d3489b50d856ec06315a47b5de05c4e8ce76da6ea854b5edf218601",
        "buildDigest": "43ae3e1037537c0afb400a23429f6ff6573c6120108f3981507ecf78350aad0a",
        "digest": "305d3c59024c7925d71d91126e61968246824353477b7b0e0e970abddb2d6f57"
      },
      "ownedSchemas": [
        {
          "schema": "herdr-codex-controller:config:v3",
          "sha256": "sha256:40a7684a3f8abef18015618509f01b409534aaddebdf88054acbc533fa7e6af5"
        },
        {
          "schema": "herdr-codex-controller:release-completion:v3",
          "sha256": "sha256:49b86fc0b173e7eaa877fc32d3cc4dc68692354fc2cc35ef0c7938a521e0bb9a"
        },
        {
          "schema": "herdr-codex-controller:release-plan:v2",
          "sha256": "sha256:362c9ae154c502ce80df16f17527c7136f4de2804da55c1c7c1314882160f363"
        }
      ],
      "qualificationStatus": "qualified",
      "activatedAt": "2026-08-31T07:59:45.000Z",
      "revocation": null,
      "historyDigest": "sha256:72c71aeee8b7bba52e6de70ff9c719ae2fe66eb95c9c46e3fdbb7d08fe8a07c2",
      "qualificationDigest": "sha256:f15fe4fe4bb651caf6dc931b9d987ab1f86ad15a92262f2da87affbe59b53aee",
      "active": true
    }
  ],
  "digest": "sha256:00e60c7f6dc95ae9447e6863126924ea838f38ba7d36fdc7a80fa7ce8d93754e"
}
